{"name":"RGB Rectangles","author":"Unknown","description":"","faces":[{"name":"Red","face":{"layout":{"flex-container":{"direction":"column","justify":"center","align-items":"center","wrap":"no-wrap","gap":{"row":0.0,"column":0.0}},"padding":{"left":10.0,"right":10.0,"top":10.0,"bottom":10.0}},"bgColor":"#FFFFFFFF","children":[{"type":"rectangle","paint":{"fill":"#FE6161FF","stroke":null,"thickness":1.0},"radius":8.0,"style":{"flex-container":{"direction":"row","justify":"flex-start","wrap":"no-wrap","gap":{"row":0.0,"column":0.0}},"flex-item":{"grow":0.0,"shrink":1.0,"basis":"auto"},"position":{"type":"static","left":"auto","right":"auto","top":"auto","bottom":"auto"},"margin":{"left":0.0,"right":0.0,"top":0.0,"bottom":0.0},"padding":{"left":0.0,"right":0.0,"top":0.0,"bottom":0.0},"overflow":"visible","display":"on","width":"100%","height":"100%","min-width":"auto","min-height":"auto","max-width":"auto","max-height":"auto","aspect-ratio":0.0},"children":[]}]}},{"name":"Green","face":{"layout":{"flex-container":{"direction":"column","justify":"center","align-items":"center","wrap":"no-wrap","gap":{"row":0.0,"column":0.0}},"padding":{"left":10.0,"right":10.0,"top":10.0,"bottom":10.0}},"bgColor":"#FFFFFFFF","children":[{"type":"rectangle","paint":{"fill":"#22C55EFF","stroke":null,"thickness":1.0},"radius":8.0,"style":{"flex-container":{"direction":"row","justify":"flex-start","wrap":"no-wrap","gap":{"row":0.0,"column":0.0}},"flex-item":{"grow":0.0,"shrink":1.0,"basis":"auto"},"position":{"type":"static","left":"auto","right":"auto","top":"auto","bottom":"auto"},"margin":{"left":0.0,"right":0.0,"top":0.0,"bottom":0.0},"padding":{"left":0.0,"right":0.0,"top":0.0,"bottom":0.0},"overflow":"visible","display":"on","width":"100%","height":"100%","min-width":"auto","min-height":"auto","max-width":"auto","max-height":"auto","aspect-ratio":0.0},"children":[]}]}},{"name":"Blue","face":{"layout":{"flex-container":{"direction":"column","justify":"center","align-items":"center","wrap":"no-wrap","gap":{"row":0.0,"column":0.0}},"padding":{"left":10.0,"right":10.0,"top":10.0,"bottom":10.0}},"bgColor":"#FFFFFFFF","children":[{"type":"rectangle","paint":{"fill":"#6971FFFF","stroke":null,"thickness":1.0},"radius":8.0,"style":{"flex-container":{"direction":"row","justify":"flex-start","wrap":"no-wrap","gap":{"row":0.0,"column":0.0}},"flex-item":{"grow":0.0,"shrink":1.0,"basis":"auto"},"position":{"type":"static","left":"auto","right":"auto","top":"auto","bottom":"auto"},"margin":{"left":0.0,"right":0.0,"top":0.0,"bottom":0.0},"padding":{"left":0.0,"right":0.0,"top":0.0,"bottom":0.0},"overflow":"visible","display":"on","width":"100%","height":"100%","min-width":"auto","min-height":"auto","max-width":"auto","max-height":"auto","aspect-ratio":0.0},"children":[]}]}}]}