{"name":"Graph","author":"Unknown","description":"","faces":[{"name":"Graph View","face":{"layout":{"flex-container":{"direction":"column","justify":"center","align-items":"center","wrap":"no-wrap","gap":{"row":0.0,"column":0.0}},"padding":{"left":16.0,"right":16.0,"top":16.0,"bottom":16.0}},"bgColor":"#0B0F14FF","children":[{"type":"graph","seconds":10.0,"bgColor":"#07111BFF","secondsColor":"#94A3B8FF","graphColor":"#22C55EFF","borderColor":"#FFFFFFFF","value":{"id":"engineRPM","min":0.0,"max":8000.0,"unitIndex":null},"style":{"flex-container":{"direction":"row","justify":"flex-start","wrap":"no-wrap","gap":{"row":0.0,"column":0.0}},"flex-item":{"grow":0.0,"shrink":1.0,"basis":"auto"},"position":{"type":"static","left":"auto","right":"auto","top":"auto","bottom":"auto"},"margin":{"left":0.0,"right":0.0,"top":0.0,"bottom":0.0},"padding":{"left":0.0,"right":0.0,"top":0.0,"bottom":0.0},"overflow":"visible","display":"on","width":"100%","height":"100%","min-width":"auto","min-height":"auto","max-width":"auto","max-height":"auto","aspect-ratio":0.0},"children":[]}]}}]}