{"name":"Tach","author":"Unknown","description":"","faces":[{"name":"Tachometer","face":{"layout":{"flex-container":{"direction":"column","justify":"flex-start","wrap":"no-wrap","gap":{"row":8.0,"column":0.0}},"padding":{"left":10.0,"right":10.0,"top":10.0,"bottom":10.0}},"bgColor":"#07111BFF","children":[{"type":"circular-element","value":{"id":"engineRPM","min":0.0,"max":8000.0,"unitIndex":null},"startAngle":150.0,"endAngle":390.0,"style":{"flex-container":{"direction":"row","justify":"flex-start","wrap":"no-wrap","gap":{"row":0.0,"column":0.0}},"flex-item":{"grow":0.0,"shrink":1.0,"basis":"auto"},"position":{"type":"static","left":"auto","right":"auto","top":"auto","bottom":"auto"},"margin":{"left":0.0,"right":0.0,"top":0.0,"bottom":0.0},"padding":{"left":0.0,"right":0.0,"top":0.0,"bottom":0.0},"overflow":"visible","display":"on","width":"100%","height":"100%","min-width":"auto","min-height":"auto","max-width":"auto","max-height":"auto","aspect-ratio":0.0},"children":[{"type":"circular-scale","ticks":{"root":{"divisions":2,"interval":1000.0,"useDivisions":false,"length":12.0,"thickness":3.0,"paint":{"fill":"#74C0FCFF","stroke":{"keyframes":[]},"thickness":1.0}},"subs":[{"divisions":4,"length":6.0,"thickness":2.0,"paint":{"fill":"#35546EFF","stroke":{"keyframes":[]},"thickness":1.0}}],"offset":0.0},"radius":1.0,"value":null,"startAngle":null,"endAngle":null,"style":{"flex-container":{"direction":"row","justify":"flex-start","wrap":"no-wrap","gap":{"row":0.0,"column":0.0}},"flex-item":{"grow":0.0,"shrink":1.0,"basis":"auto"},"position":{"type":"absolute","left":0.0,"right":0.0,"top":0.0,"bottom":0.0},"margin":{"left":0.0,"right":0.0,"top":0.0,"bottom":0.0},"padding":{"left":0.0,"right":0.0,"top":0.0,"bottom":0.0},"overflow":"visible","display":"on","width":"auto","height":"auto","min-width":"auto","min-height":"auto","max-width":"auto","max-height":"auto","aspect-ratio":0.0},"children":[]},{"type":"circular-needle","paint":{"fill":"#F97316FF","stroke":"#FFD8A8FF","thickness":2.0},"radius":0.6299999952316284,"value":null,"startAngle":null,"endAngle":null,"style":{"flex-container":{"direction":"row","justify":"flex-start","wrap":"no-wrap","gap":{"row":0.0,"column":0.0}},"flex-item":{"grow":0.0,"shrink":1.0,"basis":"auto"},"position":{"type":"absolute","left":0.0,"right":0.0,"top":0.0,"bottom":0.0},"margin":{"left":0.0,"right":0.0,"top":0.0,"bottom":0.0},"padding":{"left":0.0,"right":0.0,"top":0.0,"bottom":0.0},"overflow":"visible","display":"on","width":"auto","height":"auto","min-width":"auto","min-height":"auto","max-width":"auto","max-height":"auto","aspect-ratio":0.0},"children":[]}]}]}}]}